{
  "method": "linear_trend",
  "months": 12,
  "note": "linear_trend won the backtest (MAPE 1.5% on the last 2 months)",
  "band_pct": 10.0,
  "base": [
    59666666.67,
    62952380.95,
    66238095.24,
    69523809.52,
    72809523.81,
    76095238.1,
    79380952.38,
    82666666.67,
    85952380.95,
    89238095.24,
    92523809.52,
    95809523.81
  ],
  "low": [
    53700000.0,
    56657142.86,
    59614285.71,
    62571428.57,
    65528571.43,
    68485714.29,
    71442857.14,
    74400000.0,
    77357142.86,
    80314285.71,
    83271428.57,
    86228571.43
  ],
  "high": [
    65633333.33,
    69247619.05,
    72861904.76,
    76476190.48,
    80090476.19,
    83704761.9,
    87319047.62,
    90933333.33,
    94547619.05,
    98161904.76,
    101776190.48,
    105390476.19
  ],
  "backtest": {
    "holdout_months": 2,
    "holdout_actual": [
      52000000.0,
      57000000.0
    ],
    "scores": [
      {
        "method": "naive",
        "mape": 0.0806,
        "usable": true,
        "holdout_predictions": [
          50000000.0,
          50000000.0
        ]
      },
      {
        "method": "linear_trend",
        "mape": 0.0153,
        "usable": true,
        "holdout_predictions": [
          53500000.0,
          56900000.0
        ]
      },
      {
        "method": "compound_growth",
        "mape": 0.0268,
        "usable": true,
        "holdout_predictions": [
          53860867.25,
          58019860.42
        ]
      }
    ],
    "winner": "linear_trend",
    "winner_mape": 0.0153
  },
  "flags": [],
  "cost": {
    "low": {
      "annual_inr": 209892.86,
      "monthly_inr": [
        13425.0,
        14164.29,
        14903.57,
        15642.86,
        16382.14,
        17121.43,
        17860.71,
        18600.0,
        19339.29,
        20078.57,
        20817.86,
        21557.14
      ]
    },
    "base": {
      "annual_inr": 233214.29,
      "monthly_inr": [
        14916.67,
        15738.1,
        16559.52,
        17380.95,
        18202.38,
        19023.81,
        19845.24,
        20666.67,
        21488.1,
        22309.52,
        23130.95,
        23952.38
      ]
    },
    "high": {
      "annual_inr": 256535.71,
      "monthly_inr": [
        16408.33,
        17311.9,
        18215.48,
        19119.05,
        20022.62,
        20926.19,
        21829.76,
        22733.33,
        23636.9,
        24540.48,
        25444.05,
        26347.62
      ]
    }
  }
}
